{
  "contract": {
    "name": "dsl-core.report",
    "version": "0.1.0",
    "schema": "schemas/report.schema.json"
  },
  "engine": {
    "name": "dsl-core",
    "version": "0.1.0"
  },
  "generatedAt": "2026-02-14T16:00:00Z",
  "target": {
    "path": "-",
    "kind": "stdin"
  },
  "summary": {
    "files": 1,
    "statements": 1,
    "valid": 1,
    "invalid": 0,
    "parseErrors": 0
  },
  "files": [
    {
      "path": "-",
      "counts": {
        "statements": 1,
        "valid": 1,
        "invalid": 0,
        "parseErrors": 0
      },
      "statements": [
        {
          "source": "stdin:1",
          "input": "AFO REQ-001",
          "validation": {
            "valid": true,
            "errors": []
          }
        }
      ]
    }
  ]
}
